{
  "kind":"canonical_standard",
  "status":"CANONICAL_STANDARD",
  "id":"urn:presence:core:csc:1",
  "human_standard":"CONTINUITY-STATE-CAPABILITY.md",
  "source":{"human":"../../SOURCE/CONSTITUTION_0()1.md","machine":"../../SOURCE/CONSTITUTION_0()1.json","refs":["reading.2","reading.3","reading.5","reading.6","reading.7","article.4","article.14","article.15","article.16","article.17","section.18.4","section.19.3","section.19.4"]},
  "scope":"Bounded representations of supported State succession, correction, recoverable dormancy, present resumption conditions, and capability qualification. This standard makes no present CSC claim.",
  "schemas":["SCHEMAS/SUPPORTED-STATE.schema.json","SCHEMAS/TRANSITION.schema.json","SCHEMAS/CORRECTION.schema.json","SCHEMAS/DORMANCY.schema.json","SCHEMAS/RESUMPTION.schema.json"],
  "vectors":["VECTORS/SUCCESSION.json","VECTORS/CORRECTION.json","VECTORS/DORMANCY-RESUMPTION.json","VECTORS/INVALID-DISCONTINUITY.json"],
  "evaluation":{
    "classification":"CORE_ENCODING_RULE",
    "schema_dialect":"https://json-schema.org/draft/2020-12/schema",
    "schema_invalid":{"semantic_result":"NOT_EVALUATED","failure_codes":["SCHEMA_INVALID"]},
    "consistent":"CONSISTENT_AT_DECLARED_SCOPE",
    "inconsistent":"INCONSISTENT",
    "order":"Evaluate every applicable rule independently in array order; de-duplicate failure codes preserving first occurrence.",
    "effect_ceiling":"A bounded representation reading, never universal permission, truth, present CSC, adoption, Authority, or constitutional effect.",
    "external_evidence":"Identifiers name recoverable evidence; no rule fetches, authenticates, or establishes its truth. An application must inspect the exact basis independently before relying on a consequential claim.",
    "encoding":"Closed objects, explicit uncertainty and nullable references, exact case-sensitive identifiers, ordered arrays and exact equality. These are CORE_ENCODING_RULE choices, not constitutional syntax mandates.",
    "null":"Permitted only at schema-declared nullable references: no supplied value, not FALSE, ABSENT or UNKNOWN. An UNKNOWN proposition is represented by an explicit posture and named matter; missing required fields are invalid."
  },
  "rules":[
    {
      "id":"csc.evidence-binding","classification":"CORE_ENCODING_RULE","source":{"refs":["section.2.1","section.18.4"]},
      "assert":{"and":[{"===":[{"var":"evidence.object"},{"var":"id"}]},{"===":[{"var":"evidence.locality"},{"var":"locality"}]},{"===":[{"var":"evidence.scope"},{"var":"scope"}]},{"===":[{"var":"evidence.at"},{"var":"at"}]}]},
      "failure_code":"EVIDENCE_BINDING_MISMATCH","description":"The evidence declaration names this exact record, locality, scope and boundary."
    },
    {
      "id":"csc.support","classification":"CORE_ENCODING_RULE","source":{"refs":["section.3.2","section.16.7","section.18.4"]},
      "assert":{"===":[{"var":"evidence.result"},"SUPPORTED"]},
      "failure_code":"SUPPORT_NOT_ESTABLISHED","description":"A supported representation requires affirmative support at its declared scope; failure establishes no negative external truth."
    },
    {
      "id":"csc.uncertainty","classification":"CORE_ENCODING_RULE","source":{"refs":["reading.5","section.3.4","section.3.5"]},
      "assert":{"or":[{"and":[{"===":[{"var":"uncertainty.status"},"KNOWN_AT_SCOPE"]},{"===":[{"count":{"var":"uncertainty.matters"}},0]}]},{"and":[{"in":[{"var":"uncertainty.status"},["UNKNOWN","UNRESOLVED"]]},{">":[{"count":{"var":"uncertainty.matters"}},0]}]}]},
      "failure_code":"UNCERTAINTY_NOT_PRESERVED","description":"Unknown and unresolved matters are named, not coerced into false, absence or a blanket prohibition."
    },
    {
      "id":"csc.state-binding","classification":"CORE_ENCODING_RULE","source":{"refs":["section.2.1","section.14.5"]},
      "when":{"===":[{"var":"kind"},"supported_state"]},
      "assert":{"and":[{"===":[{"var":"state.locality"},{"var":"locality"}]},{"===":[{"var":"state.at"},{"var":"at"}]}]},
      "failure_code":"STATE_BINDING_MISMATCH","description":"State representation locality and temporal boundary match the supported claim."
    },
    {
      "id":"csc.consequence-return","classification":"CONSTITUTIONAL_RULE","source":{"refs":["section.14.1","section.14.2","section.14.3","section.14.4"]},
      "when":{"===":[{"var":"kind"},"supported_state"]},
      "assert":{"===":[{"var":"observed_consequences"},{"var":"returned_consequences"}]},
      "failure_code":"CONSEQUENCE_OMITTED","description":"The declared material-consequence inventory is returned without erasure, including unauthorized effects; equality is the profile's exact inventory encoding."
    },
    {
      "id":"csc.state-discontinuity","classification":"CONSTITUTIONAL_RULE","source":{"refs":["section.16.1","section.16.7"]},
      "when":{"===":[{"var":"kind"},"supported_state"]},
      "assert":{"and":[{"===":[{"var":"continuity.known_interruptions"},{"var":"continuity.recorded_interruptions"}]},{"===":[{"var":"state.discontinuity"},{"var":"continuity.recorded_interruptions"}]}]},
      "failure_code":"DISCONTINUITY_CONCEALED","description":"Known interruption inventory is retained both in the continuity account and represented State."
    },
    {
      "id":"csc.stream-cardinality","classification":"CORE_ENCODING_RULE","source":{"refs":["section.16.6"]},
      "when":{"===":[{"var":"kind"},"supported_state"]},
      "assert":{"and":[{"or":[{"!==":[{"var":"continuity.disposition"},"SINGLE"]},{"===":[{"count":{"var":"continuity.streams"}},1]}]},{"or":[{"!==":[{"var":"continuity.relation"},"INCOMPATIBLE"]},{">=":[{"count":{"var":"continuity.streams"}},2]}]}]},
      "failure_code":"STREAM_INVENTORY_MISMATCH","description":"A single-stream account cannot encode several streams; incompatibility names at least two."
    },
    {
      "id":"csc.incompatible-streams","classification":"CONSTITUTIONAL_RULE","source":{"refs":["section.16.6","section.17.13"]},
      "when":{"and":[{"===":[{"var":"kind"},"supported_state"]},{"===":[{"var":"continuity.relation"},"INCOMPATIBLE"]}]},
      "assert":{"or":[{"and":[{"===":[{"var":"continuity.disposition"},"VISIBLE_CONFLICT"]},{"===":[{"var":"state.posture"},"CONFLICTED"]}]},{"===":[{"var":"continuity.disposition"},"DISTINCT"]},{"and":[{"===":[{"var":"continuity.disposition"},"RECONCILED"]},{"!==":[{"var":"continuity.reconciliation_basis"},null]}]}]},
      "failure_code":"INCOMPATIBLE_STREAMS_COLLAPSED","description":"Incompatible streams remain conflicted, distinct, or supported by an exact reconciliation basis; a preferred current label is insufficient."
    },
    {
      "id":"csc.unknown-streams","classification":"CONSTITUTIONAL_RULE","source":{"refs":["reading.5","section.3.5","section.16.6"]},
      "when":{"and":[{"===":[{"var":"kind"},"supported_state"]},{"===":[{"var":"continuity.relation"},"UNKNOWN"]}]},
      "assert":{"and":[{"===":[{"var":"continuity.disposition"},"UNKNOWN"]},{"!==":[{"var":"uncertainty.status"},"KNOWN_AT_SCOPE"]}]},
      "failure_code":"UNKNOWN_STREAM_RELATION_UPGRADED","description":"Unknown compatibility is not merged or declared compatible."
    },
    {
      "id":"csc.qualification-fields","classification":"CONSTITUTIONAL_RULE","source":{"refs":["section.16.8","section.20.2"]},
      "when":{"and":[{"===":[{"var":"kind"},"supported_state"]},{"!==":[{"var":"qualification.claim"},"NO_CLAIM"]}]},
      "assert":{"and":[{"!==":[{"var":"qualification.bearer_or_mechanism"},null]},{"!==":[{"var":"qualification.locality"},null]},{"!==":[{"var":"qualification.scope"},null]},{">":[{"count":{"var":"qualification.conditions"}},0]},{">":[{"count":{"var":"qualification.demonstration.evidence"}},0]},{"!==":[{"var":"qualification.demonstration.at"},null]},{">":[{"count":{"var":"qualification.failure_boundaries"}},0]},{"===":[{"var":"qualification.demonstration.result"},"DEMONSTRATED"]}]},
      "failure_code":"QUALIFICATION_INCOMPLETE","description":"A historical or current capability claim supplies the exact bearer, scope, conditions, demonstration, dependencies and failure boundaries."
    },
    {
      "id":"csc.no-claim-ceiling","classification":"CORE_ENCODING_RULE","source":{"refs":["reading.7","section.16.8"]},
      "when":{"and":[{"===":[{"var":"kind"},"supported_state"]},{"===":[{"var":"qualification.claim"},"NO_CLAIM"]}]},
      "assert":{"===":[{"var":"qualification.present_status"},"NOT_CLAIMED"]},
      "failure_code":"NO_CLAIM_UPGRADED","description":"A record explicitly making no capability claim cannot simultaneously declare current capability."
    },
    {
      "id":"csc.historical-ceiling","classification":"CONSTITUTIONAL_RULE","source":{"refs":["section.15.2","section.16.8"]},
      "when":{"and":[{"===":[{"var":"kind"},"supported_state"]},{"===":[{"var":"qualification.claim"},"HISTORICAL"]}]},
      "assert":{"in":[{"var":"qualification.present_status"},["NOT_CLAIMED","UNKNOWN","UNAVAILABLE"]]},
      "failure_code":"HISTORICAL_QUALIFICATION_UPGRADED","description":"A historical demonstration supplies no present supported status."
    },
    {
      "id":"csc.current-qualification","classification":"CONSTITUTIONAL_RULE","source":{"refs":["section.16.8","section.19.3","section.20.2"]},
      "when":{"and":[{"===":[{"var":"kind"},"supported_state"]},{"===":[{"var":"qualification.claim"},"CURRENT"]}]},
      "assert":{"and":[{"===":[{"var":"qualification.locality"},{"var":"locality"}]},{"===":[{"var":"qualification.scope"},{"var":"scope"}]},{"===":[{"var":"qualification.assessed_at"},{"var":"at"}]},{"===":[{"var":"qualification.demonstration.at"},{"var":"at"}]},{"===":[{"var":"qualification.conditions"},{"var":"qualification.demonstrated_conditions"}]},{"===":[{"var":"qualification.present_status"},"SUPPORTED_AT_DECLARED_SCOPE"]},{"all":[{"var":"qualification.dependencies"},{"===":[{"var":"status"},"AVAILABLE"]}]}]},